芥川龍之介	0	煙草は、本来、日本になかつた植物である。では、何時頃、舶載されたかと云ふと、記録によつて、年代が致しない。或は、慶長年間と書いてあつたり、或は天文年間と書いてあつたりする。が、慶長年頃には、既に栽培が、諸方に行はれてゐたらしい。それが文禄年間になると、「きかぬものたばこの法度銭法度、玉のみこゑにげんたくの医者」と云ふ落首が出来た程、般に喫煙が流行するやうになつた。そこで、この煙草は、誰の手で舶載されたかと云ふと、歴史家なら誰でも、葡萄牙人とか、西班牙人とか答へる。が、それは必ずしも唯の答ではない。その外にまだ、もうつ、伝説としての答が残つてゐる。それによると、煙草は、悪魔がどこからか持つて来たのださうである。さうして、その悪魔なるものは、天主教の伴天連か（恐らくは、フランシス上人）がはるばる日本へつれて来たのださうである。かう云ふと、切支丹宗門の信者は、彼等のパアテルを誣ひるものとして、自分を咎めようとするかも知れない。が、自分に云はせると、これはどうも、事実らしく思はれる。何故と云へば、南蛮の神が渡来すると同時に、南蛮の悪魔が渡来すると云ふ事は西洋の善が輸入されると同時に、西洋の悪が輸入されると云ふ事は、至極、当然な事だからである。しかし、その悪魔が実際、煙草を持つて来たかどうか、それは、自分にも、保証する事が出来ない。尤もアナトオル・フランスの書いた物によると、悪魔は木犀草の花で、或坊さんを誘惑しようとした事があるさうである。して見ると、煙草を、日本へ持つて来たと云ふ事も、満更嘘だとばかりは、云へないであらう。よし又それが嘘にしても、その嘘は又、或意味で、存外、ほんとうに近い事があるかも知れない。自分は、かう云ふ考へで、煙草の渡来に関する伝説を、ここに書いて見る事にした。＊＊＊天文年、悪魔は、フランシス・ザヴイエルに伴いてゐる伊留満の人に化けて、長い海路を恙なく、日本へやつて来た。この伊留満の人に化けられたと云ふのは、正物のその男が、阿媽港か何処かへ上陸してゐる中に、行をのせた黒船が、それとも知らずに出帆をしてしまつたからである。そこで、それまで、帆桁へ尻尾をまきつけて、倒にぶら下りながら、私に船中の容子を窺つてゐた悪魔は、早速姿をその男に変へて、朝夕フランシス上人に、給仕する事になつた。勿論、ドクトル・フアウストを尋ねる時には、赤い外套を着た立派な騎士に化ける位な先生の事だから、こんな芸当なぞは、何でもない。所が、日本へ来て見ると、西洋にゐた時に、マルコ・ポオロの旅行記で読んだのとは、大分、容子がちがふ。第、あの旅行記によると、国中至る処、黄金がみちみちてゐるやうであるが、どこを見廻しても、そんな景色はない。これなら、ちよいと磔を爪でこすつて、金にすれば、それでも可成、誘惑が出来さうである。それから、日本人は、真珠か何かの力で、起死回生の法を、心得てゐるさうであるが、それもマルコ・ポオロの嘘らしい。嘘なら、方々の井戸へ唾を吐いて、悪い病さへ流行らせれば、大抵の人間は、苦しまぎれに当来の波羅葦僧なぞは、忘れてしまふ。フランシス上人の後へついて、殊勝らしく、そこいらを見物して歩きながら、悪魔は、私にこんな事を考へて、独り会心の微笑をもらしてゐた。が、たつたつ、ここに困つた事がある。こればかりは、流石の悪魔が、どうする訳にも行かない。と云ふのは、まだフランシス・ザヴイエルが、日本へ来たばかりで、伝道も盛にならなければ、切支丹の信者も出来ないので、肝腎の誘惑する相手が、人もゐないと云ふ事である。これには、いくら悪魔でも、少からず、当惑した。第、さしあたり退屈な時間を、どうして暮していいか、わからない。そこで、悪魔は、いろいろ思案した末に、先園芸でもやつて、暇をつぶさうと考へた。それには、西洋を出る時から、種々雑多な植物の種を、耳の穴の中へ入れて持つてゐる。地面は、近所の畠でも借りれば、造作はない。その上、フランシス上人さへ、それは至極よからうと、賛成した。勿論、上人は、自分についてゐる伊留満の人が、西洋の薬用植物か何かを、日本へ移植しようとしてゐるのだと、思つたのである。悪魔は、早速、鋤鍬を借りて来て、路ばたの畠を、根気よく、耕しはじめた。丁度水蒸気の多い春の始で、たなびいた霞の底からは、遠くの寺の鐘が、ぼうんと、眠むさうに、響いて来る、その鐘の音が、如何にも又のどかで、聞きなれた西洋の寺の鐘のやうに、いやに冴えて、かんと脳天へひびく所がない。が、かう云ふ太平な風物の中にゐたのでは、さぞ悪魔も、気が楽だらうと思ふと、決してさうではない。彼は、度この梵鐘の音を聞くと、聖保羅の寺の鐘を聞いたよりも、層、不快さうに、顔をしかめて、むしやうに畑を打ち始めた。何故かと云ふと、こののんびりした鐘の音を聞いて、この曖々たる日光に浴してゐると、不思議に、心がゆるんで来る。善をしようと云ふ気にもならないと同時に、悪を行はうと云ふ気にもならずにしまふ。これでは、折角、海を渡つて、日本人を誘惑に来た甲斐がない。掌に肉豆がないので、イワンの妹に叱られた程、労働の嫌な悪魔が、こんなに精を出して、鍬を使ふ気になつたのは、全く、このややもすれば、体にはひかかる道徳的の眠けを払はうとして、生懸命になつたせゐである。悪魔は、とうとう、数日の中に、畑打ちを完つて、耳の中の種を、その畦に播いた。＊＊＊それから、幾月かたつ中に、悪魔の播いた種は、芽を出し、茎をのばして、その年の夏の末には、幅の広い緑の葉が、もう残りなく、畑の土を隠してしまつた。が、その植物の名を知つてゐる者は、人もない。フランシス上人が、尋ねてさへ、悪魔は、にやにや笑ふばかりで、何とも答へずに、黙つてゐる。その中に、この植物は、茎の先に、簇々として、花をつけた。漏斗のやうな形をした、うす紫の花である。悪魔には、この花のさいたのが、骨を折つただけに、大へん嬉しいらしい。そこで、彼は、朝夕の勤行をすましてしまふと、何時でも、その畑へ来て、余念なく培養につとめてゐた。すると、或日の事、（それは、フランシス上人が伝道の為に、数日間、旅行をした、その留守中の出来事である。）人の牛商人が、頭の黄牛をひいて、その畑の側を通りかかつた。見ると、紫の花のむらがつた畑の柵の中で、黒い僧服に、つばの広い帽子をかぶつた、南蛮の伊留満が、しきりに葉へついた虫をとつてゐる。牛商人は、その花があまり、珍しいので、思はず足を止めながら、笠をぬいで、丁寧にその伊留満へ声をかけた。もし、お上人様、その花は何でございます。伊留満は、ふりむいた。鼻の低い、眼の小さな、如何にも、人の好ささうな紅毛である。これですか。さやうでございます。紅毛は、畑の柵によりかかりながら、頭をふつた。さうして、なれない日本語で云つた。この名だけは、御気の毒ですが、人には教へられません。はてな、すると、フランシス様が、云つてはならないとでも、仰有つたのでございますか。いいえ、さうではありません。では、つお教へ下さいませんか、手前も、近ごろはフランシス様の御教化をうけて、この通り御宗旨に、帰依して居りますのですから。牛商人は、得意さうに自分の胸を指さした。見ると、成る程、小さな真鍮の字架が、日に輝きながら、頸にかかつてゐる。す	1	0	0	0	0	0	0	0	0	0
芥川龍之介	0	歳晩のある暮方、自分は友人の批評家と人で、所謂腰弁街道の、裸になった並樹の柳の下を、神田橋の方へ歩いていた。自分たちの左右には、昔、島崎藤村が「もっと頭をあげて歩け」と慷慨した、下級官吏らしい人々が、まだ漂っている黄昏の光の中に、蹌踉たる歩みを運んで行く。期せずして、同じく憂鬱な心もちを、払いのけようとしても払いのけられなかったからであろう。自分たちは外套の肩をすり合せるようにして、心もち足を早めながら、大手町の停留場を通りこすまでは、ほとんど言もきかずにいた。すると友人の批評家が、あすこの赤い柱の下に、電車を待っている人々の寒むそうな姿を瞥すると、急に身ぶるいをつして、「毛利先生の事を思い出す。」と、独り語のように呟いた。「毛利先生と云うのは誰だい。」「僕の中学の先生さ。まだ君には話した事がなかったかな。」自分は否と云う代りに、黙って帽子の庇を下げた。これから下に掲げるのはその時その友人が、歩きながら自分に話してくれた、その毛利先生の追憶である。もうかれこれ年ばかり以前、自分がまだある府立中学の年級にいた時の事である。自分の級に英語を教えていた、安達先生と云う若い教師が、インフルエンザから来た急性肺炎で冬期休業の間に物故してしまった。それが余り突然だったので、適当な後任を物色する余裕がなかったからの窮策であろう。自分の中学は、当時ある私立中学で英語の教師を勤めていた、毛利先生と云う老人に、今まで安達先生の受持っていた授業を時嘱託した。自分が始めて毛利先生を見たのは、その就任当日の午後である。自分たち年級の生徒たちは、新しい教師を迎えると云う好奇心に圧迫されて、廊下に先生の靴音が響いた時から、いつになくひっそりと授業の始まるのを待ちうけていた。所がその靴音が、日かげの絶えた、寒い教室の外に止まって、やがて扉が開かれると、ああ、自分はこう云う中にも、歴々とその時の光景が眼に浮んでいる。扉を開いてはいって来た毛利先生は、何より先その背の低いのがよく縁日の見世物に出る蜘蛛男と云うものを聯想させた。が、その感じから暗澹たる色彩を奪ったのは、ほとんど美しいとでも形容したい、光滑々たる先生の禿げ頭で、これまた後頭部のあたりに、種々たる胡麻塩の髪の毛が、わずかに残喘を保っていたが、大部分は博物の教科書に画が出ている駝鳥の卵なるものと相違はない。最後に先生の風采を凡人以上に超越させたものは、その怪しげなモオニング・コオトで、これは過去において黒かったと云う事実を危く忘却させるくらい、文字通り蒼然たる古色を帯びたものであった。しかも先生のうすよごれた折襟には、極めて派手な紫の襟飾が、まるで翼をひろげた蛾のように、ものものしく結ばれていたと云う、驚くべき記憶さえ残っている。だから先生が教室へはいると同時に、期せずして笑を堪える声が、そこここの隅から起ったのは、元より不思議でも何でもない。が、読本と出席簿とを抱えた毛利先生は、あたかも眼中に生徒のないような、悠然とした態度を示しながら、段高い教壇に登って、自分たちの敬礼に答えると、いかにも人の好さそうな、血色の悪い丸顔に愛嬌のある微笑を漂わせて、「諸君」と、金切声で呼びかけた。自分たちは過去年間、未嘗てこの中学の先生から諸君を以て遇せられた事は、度もない。そこで毛利先生のこの「諸君」は、勢い自分たち同に、思わず驚嘆の眼を見開かせた。と同時に自分たちは、すでに「諸君」と口を切った以上、その後はさしずめ授業方針か何かの大演説があるだろうと、息をひそめて待ちかまえていたのである。しかし毛利先生は、「諸君」と云ったまま、教室の中を見廻して、しばらくは何とも口を開かない。肉のたるんだ先生の顔には、悠然たる微笑の影が浮んでいるのに関らず、口角の筋肉は神経的にびくびく動いている。と思うと、どこか家畜のような所のある晴々した眼の中にも、絶えず落ち着かない光が去来した。それがどうも口にこそ出さないが、何か自分たち同に哀願したいものを抱いていて、しかもその何ものかと云う事が、先生自身にも遺憾ながら判然と見きわめがつかないらしい。「諸君」やがて毛利先生は、こう同じ調子で繰返した。それから今度はその後へ、丁度その諸君と云う声の反響を捕えようとする如く、「これから私が、諸君にチョイス・リイダアを教える事になりました」と、いかにも慌しくつけ加えた。自分たちはますます好奇心の緊張を感じて、ひっそりと鳴りを静めながら、熱心に先生の顔を見守っていた。が、毛利先生はそう云うと同時に、また哀願するような眼つきをして、ぐるりと教室の中を見廻すと、それぎりで急に椅子の上へ弾機がはずれたように腰を下した。そうして、すでに開かれていたチョイス・リイダアの傍へ、出席簿をひろげて眺め出した。この唐突たる挨拶の終り方が、いかに自分たちを失望させたか、と云うよりもむしろ、失望を通り越して、いかに自分たちを滑稽に感じさせたか、それは恐らく云う必要もない事であろう。しかし幸いにして先生は、自分たちが笑を洩すのに先立って、あの家畜のような眼を出席簿から挙げたと思うと、たちまち自分たちの級の人を「さん」づけにして指名した。勿論すぐに席を離れて、訳読して見ろと云う相図である。そこでその生徒は立ち上って、ロビンソン・クルウソオか何かの節を、東京の中学生に特有な、気の利いた調子で訳読した。それをまた毛利先生は、時々紫の襟飾へ手をやりながら、誤訳は元より些細な発音の相違まで、々丁寧に直して行く。発音は妙に気取った所があるが、大体正確で、明瞭で、先生自身もこの方面が特に内心得意らしい。が、その生徒が席に復して、先生がそこを訳読し始めると、再び自分たちの間には、そこここから失笑の声が起り始めた。と云うのは、あれほど発音の妙を極めた先生も、いざ翻訳をするとなると、ほとんど日本人とは思われないくらい、日本語の数を知っていない。あるいは知っていても、その場に臨んでは急には思い出せないのであろう。たとえばたった行を訳するにしても、「そこでロビンソン・クルウソオは、とうとう飼う事にしました。何を飼う事にしたかと云えば、それ、あの妙な獣で動物園に沢山いる何と云いましたかね、ええとよく芝居をやるね、諸君も知っているでしょう。それ、顔の赤い何、猿？そうそう、その猿です。その猿を飼う事にしました。」勿論猿でさえこのくらいだから、少し面倒な語になると、何度もその周囲を低徊した揚句でなければ、容易に然るべき訳語にはぶつからない。しかも毛利先生はその度にひどく狼狽して、ほとんどあの紫の襟飾を引きちぎりはしないかと思うほど、頻に喉元へ手をやりながら、当惑そうな顔をあげて、慌しく自分たちの方へ眼を飛ばせる。と思うとまた、両手で禿げ頭を抑えながら、机の上へ顔を伏せて、いかにも面目なさそうに行きづまってしまう。そう云う時は、ただでさえ小さな先生の体が、まるで空気の抜けた護謨風船のように、意気地なく縮み上って、椅子から垂れている両足さえ、ぶらりと宙に浮びそうな心もちがした。それをまた生徒の方では、面白い事にして、くすくす笑う。そうして度先生が訳読を繰返す間には、その笑い声も次第に大胆になって、とうとうしまいには番前の机からさえ、公然と湧き返るようになった。こう云う自	1	0	0	0	0	0	0	0	0	0
